 
<MonitoredElement id="CloudService" level="SERVICE" xmlns:xsi="http://www.w3.org/2001/XMLSchema-instance"
                  xsi:noNamespaceSchemaLocation="structure.xsd">
    <MonitoredElement id="EventProcessingTopology" level="SERVICE_TOPOLOGY">
        <MonitoredElement id="LoadBalancerServiceUnit" level="SERVICE_UNIT">
            <MonitoredElement id="10.99.0.39" level="VM"/>
        </MonitoredElement>
        <MonitoredElement id="EventProcessingServiceUnit" level="SERVICE_UNIT">
            <MonitoredElement id="10.99.0.82" level="VM"/>
        </MonitoredElement>
    </MonitoredElement>
    
    <MonitoredElement id="DataEndTopology" level="SERVICE_TOPOLOGY">
        <MonitoredElement id="DataControllerServiceUnit" level="SERVICE_UNIT">
            <MonitoredElement id="10.99.0.44" level="VM"/>
        </MonitoredElement>
        
        <MonitoredElement id="DataNodeServiceUnit" level="SERVICE_UNIT">
            <MonitoredElement id="10.99.0.91" level="VM"/>
        </MonitoredElement>
    </MonitoredElement>
</MonitoredElement>
